{
  "$schema": "https://anthropic.com/claude-code/marketplace.schema.json",
  "name": "agents-inc",
  "version": "1.0.0",
  "owner": {
    "name": "Agents Inc.",
    "email": "hello@agents-inc.com"
  },
  "metadata": {
    "pluginRoot": "./dist/plugins"
  },
  "plugins": [
    {
      "name": "api-analytics-posthog-analytics",
      "source": "./dist/plugins/api-analytics-posthog-analytics",
      "description": "PostHog event tracking, user identification, group analytics for B2B, GDPR consent patterns. Use when implementing product analytics, tracking user behavior, setting up funnels, or configuring privacy-compliant tracking.",
      "version": "1.0.0",
      "author": {
        "name": "@vince"
      },
      "keywords": [
        "posthog",
        "analytics",
        "event-tracking",
        "user-identification"
      ],
      "category": "api"
    },
    {
      "name": "api-analytics-setup-posthog",
      "source": "./dist/plugins/api-analytics-setup-posthog",
      "description": "PostHog analytics and feature flags setup",
      "version": "1.0.0",
      "author": {
        "name": "@vince"
      },
      "keywords": [
        "posthog",
        "setup",
        "analytics",
        "feature-flags",
        "installation"
      ],
      "category": "api"
    },
    {
      "name": "api-auth-better-auth-drizzle-hono",
      "source": "./dist/plugins/api-auth-better-auth-drizzle-hono",
      "description": "Better Auth patterns, sessions, OAuth",
      "version": "1.0.0",
      "author": {
        "name": "@vince"
      },
      "keywords": [
        "better-auth",
        "sessions",
        "oauth",
        "authentication",
        "authorization"
      ],
      "category": "api"
    },
    {
      "name": "api-ci-cd-github-actions",
      "source": "./dist/plugins/api-ci-cd-github-actions",
      "description": "GitHub Actions, pipelines, deployment",
      "version": "1.0.0",
      "author": {
        "name": "@vince"
      },
      "keywords": [
        "github-actions",
        "pipelines",
        "deployment",
        "ci",
        "cd",
        "automation"
      ],
      "category": "api"
    },
    {
      "name": "api-database-drizzle",
      "source": "./dist/plugins/api-database-drizzle",
      "description": "Drizzle ORM, queries, migrations",
      "version": "1.0.0",
      "author": {
        "name": "@vince"
      },
      "keywords": [
        "drizzle",
        "orm",
        "database",
        "migrations",
        "queries",
        "postgresql"
      ],
      "category": "api"
    },
    {
      "name": "api-database-prisma",
      "source": "./dist/plugins/api-database-prisma",
      "description": "Prisma ORM, type-safe queries, migrations, relations",
      "version": "1.0.0",
      "author": {
        "name": "@vince"
      },
      "keywords": [
        "prisma",
        "orm",
        "database",
        "typescript",
        "migrations",
        "queries",
        "postgresql",
        "mysql",
        "sqlite",
        "type-safety"
      ],
      "category": "api"
    },
    {
      "name": "api-email-resend-react-email",
      "source": "./dist/plugins/api-email-resend-react-email",
      "description": "Resend + React Email templates",
      "version": "1.0.0",
      "author": {
        "name": "@vince"
      },
      "keywords": [
        "resend",
        "react-email",
        "email",
        "templates",
        "transactional"
      ],
      "category": "api"
    },
    {
      "name": "api-email-setup-resend",
      "source": "./dist/plugins/api-email-setup-resend",
      "description": "Resend email setup, domain verification",
      "version": "1.0.0",
      "author": {
        "name": "@vince"
      },
      "keywords": [
        "resend",
        "setup",
        "email",
        "domain-verification",
        "installation"
      ],
      "category": "api"
    },
    {
      "name": "api-flags-posthog-flags",
      "source": "./dist/plugins/api-flags-posthog-flags",
      "description": "PostHog feature flags, rollouts, A/B testing. Use when implementing gradual rollouts, A/B tests, kill switches, remote configuration, beta features, or user targeting with PostHog.",
      "version": "1.0.0",
      "author": {
        "name": "@vince"
      },
      "keywords": [
        "posthog",
        "feature-flags",
        "rollouts",
        "ab-testing",
        "experiments"
      ],
      "category": "api"
    },
    {
      "name": "api-framework-express",
      "source": "./dist/plugins/api-framework-express",
      "description": "Express.js routes, middleware, error handling, request/response patterns",
      "version": "1.0.0",
      "author": {
        "name": "@vince"
      },
      "keywords": [
        "express",
        "expressjs",
        "nodejs",
        "rest-api",
        "middleware",
        "routing",
        "http"
      ],
      "category": "api"
    },
    {
      "name": "api-framework-fastify",
      "source": "./dist/plugins/api-framework-fastify",
      "description": "Fastify routes, JSON Schema validation, plugin system, TypeScript type providers",
      "version": "1.0.0",
      "author": {
        "name": "@vince"
      },
      "keywords": [
        "fastify",
        "nodejs",
        "high-performance",
        "rest-api",
        "json-schema",
        "schema-validation",
        "typebox",
        "typescript",
        "plugins",
        "encapsulation"
      ],
      "category": "api"
    },
    {
      "name": "api-framework-hono",
      "source": "./dist/plugins/api-framework-hono",
      "description": "Hono routes, OpenAPI, Zod validation",
      "version": "1.0.0",
      "author": {
        "name": "@vince"
      },
      "keywords": ["hono", "openapi", "zod", "rest-api", "validation"],
      "category": "api"
    },
    {
      "name": "api-observability-axiom-pino-sentry",
      "source": "./dist/plugins/api-observability-axiom-pino-sentry",
      "description": "Pino logging, Sentry error tracking, Axiom - structured logging with correlation IDs, error boundaries, performance monitoring, alerting",
      "version": "1.0.0",
      "author": {
        "name": "@vince"
      },
      "keywords": [
        "pino",
        "sentry",
        "axiom",
        "logging",
        "error-tracking",
        "monitoring"
      ],
      "category": "api"
    },
    {
      "name": "api-observability-setup-axiom-pino-sentry",
      "source": "./dist/plugins/api-observability-setup-axiom-pino-sentry",
      "description": "Pino, Axiom, Sentry installation - one-time project setup for logging and error tracking with source maps upload",
      "version": "1.0.0",
      "author": {
        "name": "@vince"
      },
      "keywords": [
        "pino",
        "axiom",
        "sentry",
        "setup",
        "installation",
        "logging"
      ],
      "category": "api"
    },
    {
      "name": "api-performance-api-performance",
      "source": "./dist/plugins/api-performance-api-performance",
      "description": "Query optimization, caching, indexing",
      "version": "1.0.0",
      "author": {
        "name": "@vince"
      },
      "keywords": [
        "performance",
        "query-optimization",
        "caching",
        "indexing",
        "backend"
      ],
      "category": "api"
    },
    {
      "name": "cli-framework-cli-commander",
      "source": "./dist/plugins/cli-framework-cli-commander",
      "description": "Node.js CLI development with Commander.js, @clack/prompts, and picocolors. Command structure, interactive prompts, state machines, error handling, exit codes, configuration hierarchies.",
      "version": "1.0.0",
      "author": {
        "name": "@vince"
      },
      "keywords": [
        "cli",
        "commander",
        "clack",
        "prompts",
        "terminal",
        "node",
        "interactive",
        "wizard",
        "state-machine",
        "picocolors"
      ],
      "category": "cli"
    },
    {
      "name": "cli-framework-oclif-ink",
      "source": "./dist/plugins/cli-framework-oclif-ink",
      "description": "Modern CLI development combining oclif's command framework with Ink's React-based terminal rendering",
      "version": "1.0.0",
      "author": {
        "name": "@vince"
      },
      "keywords": ["cli", "oclif", "ink", "react", "terminal", "framework"],
      "category": "cli"
    },
    {
      "name": "infra-env-setup-env",
      "source": "./dist/plugins/infra-env-setup-env",
      "description": "Environment configuration, Zod validation",
      "version": "1.0.0",
      "author": {
        "name": "@vince"
      },
      "keywords": [
        "environment",
        "env",
        "configuration",
        "zod",
        "validation",
        "dotenv"
      ],
      "category": "infra"
    },
    {
      "name": "infra-monorepo-turborepo",
      "source": "./dist/plugins/infra-monorepo-turborepo",
      "description": "Turborepo, workspaces, package architecture, @repo/* naming, exports, tree-shaking",
      "version": "1.0.0",
      "author": {
        "name": "@vince"
      },
      "keywords": [
        "turborepo",
        "workspaces",
        "monorepo",
        "package-management",
        "bun",
        "package",
        "exports",
        "conventions",
        "internal-packages",
        "typescript"
      ],
      "category": "infra"
    },
    {
      "name": "infra-tooling-setup-tooling",
      "source": "./dist/plugins/infra-tooling-setup-tooling",
      "description": "ESLint 9 flat config, Prettier, TypeScript configuration, Vite, Husky + lint-staged, commitlint - build tooling for monorepos",
      "version": "1.0.0",
      "author": {
        "name": "@vince"
      },
      "keywords": [
        "eslint",
        "prettier",
        "typescript",
        "vite",
        "rolldown",
        "configuration",
        "linting",
        "formatting",
        "bundler"
      ],
      "category": "infra"
    },
    {